{
  "meta": {
    "register_name": "Bee post-quantum coverage register",
    "product": "Bee — The Progressive Intelligence Engine (bee.heossi.com)",
    "operator": "HEOSSI (Pte.) Ltd., Singapore, UEN 202532790K",
    "version": "0.9.9",
    "date": "2026-07-07",
    "claim": "Bee provides post-quantum protection across its stored-data lifecycle and every transport hop between Bee clients and the Bee platform — with the exact scope published in this register, every covered mechanism continuously probed in production, and independent verification available to anyone.",
    "predecessor_hash": "sha384:909ad8c123d003592a9e71a206776de3f4f5fee53420a5a3a0f416f10f5f28cf1a84e6a3d4cc0e3a23c864e5468bc735",
    "chain_policy": "The canonical hash chain begins at 0.9.2, the first version to exist in canonical JSON form; 0.9.0 and 0.9.1 were prose drafts and are recorded in the changelog only, without hashes. ML-DSA signatures begin at the PG-8 key ceremony: every version from the ceremony onward carries a detached signature envelope; 0.9.x versions before the ceremony are hash-chained but unsigned drafts.",
    "disclosure_policy": {
      "internal_downgrade": "immediate",
      "public_publication_max_hours": 72,
      "exploitation_exception": "If publishing failure detail would materially aid active exploitation, the public register entry states that the row is downgraded and under security review without the exploit-enabling detail; the full detail is published when remediation lands. The downgrade itself is never delayed or suppressed, and the internal audit-ledger record is complete from the moment of detection."
    },
    "legal_scope": "This register is a factual statement of cryptographic scope at the signed version and date, not a warranty of future state. It takes precedence over all marketing language: no HEOSSI marketing claim about Bee's post-quantum posture may exceed the claim sentence and row statuses of the then-current signed version. Customer contracts referencing post-quantum coverage pin a specific register version by hash. Statuses change over time under the change-control rules herein; the version history is the record.",
    "signing": {
      "algorithm": "ML-DSA-65",
      "canonicalization": "UTF-8 JSON, lexicographically sorted keys, compact separators (',', ':'), hashed with SHA-384; the signature is computed over that canonical byte stream. The canonical hash of each version is anchored in the QNSI audit ledger together with the predecessor hash, forming the version chain.",
      "key_custody": "The register root key is an offline ML-DSA key held outside CI and outside the production credential plane; it signs only (a) new register versions prepared by a human and (b) the delegation certificate of the online downgrade signer. The online downgrade signer, held in QNSI KMS with a scoped entitlement, may sign only version increments whose diff is limited to status downgrades and probe notes — it cannot sign upgrades, mechanism changes, or claim changes. CI compromise therefore cannot mint an improved register; at worst it can trigger a visible, audit-logged downgrade.",
      "envelope": "Signatures are detached — a file cannot contain a signature over itself. Each signed version publishes bee-pq-register.v<version>.sig.json alongside the register, conforming to the signature-envelope schema (signature-envelope.schema.json): register version, canonical register hash, algorithm, signer role (offline-root or online-downgrade), key ID, public-key fingerprint, ML-DSA signature over the ASCII bytes of the register hash, timestamp, and the hash of the predecessor envelope. The online-downgrade authority limit is enforced mechanically, not by prose: the validator's --predecessor mode diffs an online-downgrade version against its hash-bound predecessor under the predecessor's downgrade_diff_policy, and without a passing diff an online-downgrade envelope cannot produce a clean VALID; the signer applies the identical check before signing.",
      "public_key_publication": "The ML-DSA verification keys (root and downgrade) are published at bee.heossi.com/trust/keys and pinned across three independent surfaces: the QNSI audit ledger (fingerprint anchored at the key ceremony), the github.com/heossihq public mirror, and the rendered register document itself. A verifier checks the key fingerprint against at least two surfaces before trusting a signature; key rotation publishes a rotation attestation signed by the outgoing root.",
      "downgrade_diff_policy": {
        "allowed_status_transitions": [
          {
            "from": "covered",
            "to": "partial"
          }
        ],
        "allowed_row_fields": [
          "status",
          "notes"
        ],
        "allowed_meta_fields": [
          "version",
          "date",
          "predecessor_hash"
        ],
        "changelog_rule": "append-only-probe-initiated"
      }
    }
  },
  "profiles": [
    {
      "id": "default",
      "tiers": [
        "Cell"
      ],
      "kem_floor": "ML-KEM-768",
      "sig_floor": "ML-DSA-65",
      "transport": "Hybrid X25519 + ML-KEM-768",
      "transport_enforcement": "prefer",
      "release_signing_root": "SLH-DSA",
      "notes": "Platform baseline. Classical fallback permitted for clients without ML-KEM support; negotiated-group rates measured and published via P-01."
    },
    {
      "id": "strict",
      "tiers": [
        "Brood",
        "Comb",
        "Buzz"
      ],
      "kem_floor": "ML-KEM-768",
      "sig_floor": "ML-DSA-65",
      "transport": "Hybrid X25519 + ML-KEM-768",
      "transport_enforcement": "prefer",
      "release_signing_root": "SLH-DSA",
      "notes": "Signed audit mandatory."
    },
    {
      "id": "maximum",
      "tiers": [
        "Hive",
        "Swarm",
        "Enclave (regulated_cloud — planned)"
      ],
      "kem_floor": "ML-KEM-1024",
      "sig_floor": "ML-DSA-87",
      "transport": "Hybrid X25519 + ML-KEM, ML-KEM-1024 preferred",
      "transport_enforcement": "prefer",
      "release_signing_root": "SLH-DSA",
      "notes": "BYOK available; signed inference receipts; tenant may opt into transport_enforcement=require on dedicated endpoints. The Enclave regulated_cloud variant maps here deliberately: a mid-market regulated-cloud tier gets ML-KEM-1024 floors and BYOK without inheriting require-enforcement (which would reject legacy corporate clients) or CNSA 2.0 obligations sized for NSS-adjacent procurement. regulated_cloud is a planned tier (goes live with the marketing-site refresh); its mapping here is target-state and must not appear in v1.0 marketing prose until the tier is live."
    },
    {
      "id": "government",
      "tiers": [
        "Enclave (private)",
        "Enclave (regulated)",
        "Enclave (sovereign)"
      ],
      "kem_floor": "ML-KEM-1024",
      "sig_floor": "ML-DSA-87",
      "transport": "Hybrid X25519 + ML-KEM-1024",
      "transport_enforcement": "require",
      "release_signing_root": "LMS",
      "notes": "AES-256 / SHA-384 baseline; classical-only handshakes rejected; endpoint TLS cipher policy pins TLS_AES_256_GCM_SHA384 (shared endpoints currently negotiate AES-128-GCM, which satisfies hybrid confidentiality on prefer-profiles but not this profile's symmetric baseline — a concrete server-configuration item verified by P-01 on require-enforcement endpoints); FIPS 140-3 module path (AWS-LC-FIPS, whose validation includes ML-KEM); SLH-DSA not used on this profile, consistent with CNSA 2.0. ML-KEM-768 / ML-DSA-65 are appropriate civilian defaults and are NOT CNSA 2.0 compliant; CNSA 2.0 names ML-KEM-1024 and ML-DSA-87."
    }
  ],
  "rows": [
    {
      "id": "R-01",
      "flow": "Client-to-platform transit: workspace, OpenAI-compatible API, MCP, mobile",
      "status": "covered",
      "mechanism": "Hybrid PQC-TLS (X25519 + ML-KEM-768; ML-KEM-1024 on maximum/government) offered and preferred on every endpoint; government profile rejects classical-only handshakes.",
      "key_holder": "platform",
      "tiers": "All",
      "effective_phase": "A",
      "gate": null,
      "probes": [
        "P-01"
      ],
      "evidence": [
        {
          "label": "Live PQC-TLS canary endpoint",
          "ships": "A"
        },
        {
          "label": "QNSI NIST ACVP conformance vectors",
          "url": "https://qnsi.heossi.com/verify/conformance",
          "ships": "live"
        },
        {
          "label": "Negotiated-group telemetry (share of sessions completing hybrid PQ key exchange, by surface)",
          "ships": "B"
        }
      ],
      "controls": [
        {
          "framework": "SOC2",
          "control": "CC6.7"
        },
        {
          "framework": "ISO27001",
          "control": "A.8.24"
        }
      ],
      "qualifiers": [
        "Hybrid key exchange requires client-side support; sessions from clients or middleboxes without ML-KEM negotiate classical TLS on prefer-enforcement profiles. The guarantee on those profiles is server-side offer-and-prefer plus published negotiation rates — not per-session PQ. Per-session PQ is guaranteed only where transport_enforcement=require."
      ]
    },
    {
      "id": "R-02",
      "flow": "Software update channels: desktop builds, SDK packages, CLI",
      "status": "covered",
      "mechanism": "Releases ML-DSA-signed with verify-on-install; SLH-DSA release root (commercial), LMS root (government profile); delivery over hybrid PQC-TLS.",
      "key_holder": "platform",
      "tiers": "All",
      "effective_phase": "B",
      "gate": null,
      "probes": [
        "P-02"
      ],
      "evidence": [
        {
          "label": "Published release-signing keys and verification instructions",
          "url": "https://bee.heossi.com/trust",
          "ships": "B"
        }
      ],
      "controls": [
        {
          "framework": "ISO27001",
          "control": "A.8.24"
        }
      ]
    },
    {